formatted_index,formatted_id,cleaned_text,Annotation,oh_label,users,hashtags,links
5682-7208-6617-0759-68,5682-7208-6617-0759-68,"The Atlantic got it exactly right, and every point in thinkprogress is easily refuted.",racism,1,@UmarFarooq_ @FaheemHus @jackmjenkins,,
5595-2398-7722-4780-16,5595-2398-7722-4780-16,"RT : cc: Silent Western feminists

MT :  Executes 7 Women For Refusing ‘Temporary Marriage’ (Rape)",racism,1,@Cameron_Gray @ILNewsFlash,#ISIS,http://t.c…
5568-3710-1572-8739-84,5568-3710-1572-8739-84,"Crucifixion, stoning, beheading, shooting, throwing off buildings - ISIS is an orgy if sadistic, gruesome methods of murder.",racism,1,,#Islam #Daesh,
5533-5845-2790-0220-16,5533-5845-2790-0220-16,"RT : "": NO religion is AS VIOLENT as abhorrent as Islam.",racism,1,@CordieMendoza @subratabanik @LeslieMarshall,,"http://t.co/iUrt6EL834"""
5552-1193-6422-7109-76,5552-1193-6422-7109-76,"The Quran spend 1/3 of it's space hating on ""unbelievers"".  That's hard to put aside.",racism,1,@IAmThe1Teacher,,http://t.co/fQ99V6SIYG
5652-8230-2541-1809-92,5652-8230-2541-1809-92,Not an armed Ezidi was around when the Daesh began to slaughter and enslave them. So what are you crying about?,racism,1,@jihadi_11 @Shami_IS_back,,
5753-2951-9529-1280-00,5753-2951-9529-1280-00,The Jews lived on 40% of the Arabian penninsula before the pedophile prophet started to murder them,racism,1,@FarooqSumar @NafeezAhmed @MaxBlumenthal,,
5754-6979-5996-3850-24,5754-6979-5996-3850-24,Your pedophile Prophet made it exceedingly clear what his intentions were for Jews and Christians.,racism,1,@harmlesstree2,,http://t.co/gVJcnOh5bm
5764-5084-3152-4990-08,5764-5084-3152-4990-08,Your terminology is as meaningless as the assumptions you make from them. Palestinians have no country and never have had one,racism,1,@roisin_morgan,,
5763-5967-0786-3589-76,5763-5967-0786-3589-76,True. And the outcome has to be bad when either group of Islamolunatics wins.,racism,1,@JakeM_1998,,
5642-1007-2725-6270-08,5642-1007-2725-6270-08,So what is to blame for the more than 100 Islamist terrorists organizations? The Book of Mormon?,racism,1,@OneLegSandpiper @DblBlackDs,,
5750-6233-5468-8880-00,5750-6233-5468-8880-00,The very definition of Islam is hatred and negativity. We have to get rid of that cancer so civilization can advance.,racism,1,@Kaya786 @fai3an_H,,
5754-6701-4698-8359-68,5754-6701-4698-8359-68,"No, shithead, they were killed or forced to convert. Mohammed started the ball rolling by beheading 600 Jewish prisoners.",racism,1,@harmlesstree2,,
5696-6069-6226-4350-08,5696-6069-6226-4350-08,I just told you that women owned property before Islam. Had nothing to do with Islam. Islam is sexist to the very core.,racism,1,@zh_ha89,,
5642-7855-9162-6510-08,5642-7855-9162-6510-08,And if you are over 12 you will have to go and die for Baghdadi next week.,racism,1,@striv5r @abunaseeha2,,
5641-0873-1709-7880-32,5641-0873-1709-7880-32,One Christ terror group that no longer exist is what scum like you use to rationalize 107 Mus terror groups,racism,1,@hassanrahman11 @ToAllahWeReturn,,
5559-0765-0219-5690-24,5559-0765-0219-5690-24,Screw Francis.  Any Pope that will not stand up for freedom of speech should not be Pope.  Get rid of the clown.,racism,1,@MaliniP,,
5696-5853-9641-1680-00,5696-5853-9641-1680-00,Islam is and insult to all mankind. Time to insult the disgusting religion back.,racism,1,@Alkanz @nslwin,,http://t.co/doUt0qrmUi
5750-5069-9467-1900-16,5750-5069-9467-1900-16,But Islam has no truth. Every word is a lie.,racism,1,@Abu_Talal2,,
5622-7439-6425-8220-16,5622-7439-6425-8220-16,RT : Women from Pakistan's Christian and Hindu minorities are particularly vulnerable to forced marriage to Muslim men.,racism,1,@KenRoth,,http://t.co…
5644-6628-7162-5560-32,5644-6628-7162-5560-32,And notice that the Persian culture was more advanced and advancing and discovering before Islam.,racism,1,@Vandaliser @sajid_fairooz @IsraeliRegime,,
5552-0080-4802-7939-84,5552-0080-4802-7939-84,And that doesn't count common crime in Muslim states.,racism,1,@JosephIsVegan @SumbelinaZ @IronmanL1 @Hatewatch,,
5644-8639-4840-4899-84,5644-8639-4840-4899-84,"Even with what Hitler did to Jews, still more want to live in the west than under hatefilled Islam",racism,1,@Vandaliser @sajid_fairooz @IsraeliRegime,,
5603-0602-1734-7070-08,5603-0602-1734-7070-08,You like words. They all say Islam is vile.,racism,1,@98Halima @BilalIGhumman @johnnygjokaj @cdnKhadija @rfrankh53,,http://t.co/z7sHiL8BDG
5522-5849-0316-4929-92,5522-5849-0316-4929-92,"Yes, might, power, and imperialism is what it is all about.  There is zero spirituality in it.  Soon the world will understand.",racism,1,@ummayman90,,
5751-5216-6417-0030-08,5751-5216-6417-0030-08,"Nobody on the Supreme Court had a clue about what a murdering, raping, bigoted, pedophile he was.",racism,1,@halalflaws @greenlinerzjm @biebervalue,,
5554-5136-3232-9729-92,5554-5136-3232-9729-92,Do you think that they do it because the prophet Mohammed fought for plunder?,racism,1,@mehrdad20090706 @TalebAshrafi @iran_policy,,
5682-7738-4031-3749-76,5682-7738-4031-3749-76,"ISIS shines a spotlight on the barbarity of Islam.  But ISIS did not create that barbarity, it simply follows it to the letter.",racism,1,,#Islam #Iraq,
5534-0477-7397-1130-24,5534-0477-7397-1130-24,Did your prophet murder apostates - yes.  Did your prophet rob caravans and commit genocide - yes.,racism,1,@IftikharAwan,,
5602-9956-1474-7280-00,5602-9956-1474-7280-00,"Honest and fair is that Islam is a religion of hate, murder,bigotry and sexism",racism,1,@BilalIGhumman @98Halima @johnnygjokaj @cdnKhadija @rfrankh53,,
5756-3069-3394-3340-16,5756-3069-3394-3340-16,The Israelis are fighting not to become the minority victims that all other minorities are.,racism,1,@SelenaKhan14 @PTISalarKhan @georgegalloway,,
5563-5110-6553-7450-24,5563-5110-6553-7450-24,"Yes, all of the land the Muslims have they got by butchering the inhabitants. And they are depraved psychopaths.",racism,1,@yuskan0723,,
5641-6979-6816-6220-16,5641-6979-6816-6220-16,Mohammed was a rapist who raped young girls and approved of the rape of slaves.,racism,1,@buttercupashby @MaDaSaHaTtEr_17,,
5633-6134-4464-7649-92,5633-6134-4464-7649-92,And the Muslim students Hadith database shows Ashia was 6 when the pedo Mohammed married her.,racism,1,@semzyxx @NAInfidels @owais00,,
5652-9215-5133-2600-32,5652-9215-5133-2600-32,Kind of the same thing the prophet Mohammed did.,racism,1,@ArarMaher,,
5634-8196-0295-5840-00,5634-8196-0295-5840-00,Mohammed had a child bride.  ISIS marries off children.,racism,1,@teddyboylocsin @tweetybird2009 @PatVPeters,,
5620-5323-0629-1180-16,5620-5323-0629-1180-16,RT : Greece is like a patient in the ICU who doesn't want to pay for the meds and hospital stay.,racism,1,@sudixitca,#EUWelfareScheme,
5580-6551-4950-7009-92,5580-6551-4950-7009-92,This guy spouted one lie after another and there is no response in this video.  Just typical lying Muslim propaganda.,racism,1,@digvijaya_28,,
5745-8833-3097-0049-92,5745-8833-3097-0049-92,If the Islamofascist lunatics stopped attacking Israel there would be peace.,racism,1,@dancohen3000 @MaxBlumenthal @NickKristof,,
5750-5130-1588-8940-16,5750-5130-1588-8940-16,No it doesn't. Islam is grossly sexist. It is a misery for women.,racism,1,@Abu_Talal2,,http://t.co/Oj3IfVg6Hc
5719-1654-0687-2170-24,5719-1654-0687-2170-24,But in Islam they can rape captive women to their hearts content and there is no law against it.,racism,1,@DianH4,,
5519-8470-0764-3320-32,5519-8470-0764-3320-32,"RT : Yazidi children who are taken from their parents, forcibly converted to Islam!",racism,1,@DilanaKurdi,#Sinjar #Shengal,http://t.co/wwzplHld7f
5746-5684-3793-8590-08,5746-5684-3793-8590-08,Wheras the Arabs really are behaving people and you scum are ignoring it.,racism,1,@dancohen3000 @MaxBlumenthal,,
5702-9755-6460-2860-16,5702-9755-6460-2860-16,They just produce Islamolunatics.,racism,1,@DianH4 @ExposeFalsehood,,http://t.co/QXIH8Bd7NV
5530-7277-6349-6259-84,5530-7277-6349-6259-84,"Like all such writers, they blab on endlessly as experts without ever having read the Quran or Hadiths.",racism,1,@ohSAMah,,
5749-8513-4308-3559-68,5749-8513-4308-3559-68,"Okay, so we understand that the Quran makes striking a woman an option and that the woman must obey the man.",racism,1,@AMohedin,,
5523-5289-7149-9770-24,5523-5289-7149-9770-24,I guess your idea of a Muslim joke looks like this.,racism,1,@_Elreda,#Islam,http://t.co/2WVivYIkk5
5740-0284-6917-5089-92,5740-0284-6917-5089-92,Islamophobia - fear of this.,racism,1,@MaxBlumenthal,,http://t.co/MTgDmZGhSQ
5752-9858-1550-1050-24,5752-9858-1550-1050-24,...the Prophet Mohammed did the same thing. Baghdadi can quote Quran and Hadiths for every action he takes.,racism,1,@loveconcursall @ottomanland,,
5677-3430-3736-3569-92,5677-3430-3736-3569-92,"The Muslims are the crusaders, microbrain.",racism,1,@ShamiObserver,,
5522-5923-0208-4999-68,5522-5923-0208-4999-68,As a percentage there are very few. And they are usually poor women who marry a Muslim man. There is nothing persuasive in Islam,racism,1,@ummayman90,,
5722-9211-2101-7200-00,5722-9211-2101-7200-00,The fact that I have a brain prevents me from accepting Islam.,racism,1,@zakirnaikirf,,
5573-6445-6443-7610-24,5573-6445-6443-7610-24,"Again, the woman must be obedient to the man, even if he is a fool and she is brilliant.  You are proving my point again.",racism,1,@Ammaawah @jm111t,,
5749-8790-1747-9249-92,5749-8790-1747-9249-92,RT : to be clear white boys singing abt hanging niggers got them police protection. black ppl chanting Black Lives Matter got them…,racism,1,@dstfelix,,
5644-7422-7986-6780-16,5644-7422-7986-6780-16,Why do you think Israel is most technological country in that part of world,racism,1,@Vandaliser @sajid_fairooz @IsraeliRegime,,http://t.co/KWo0Uis3RD
5750-4767-2412-8359-68,5750-4767-2412-8359-68,A phobia is an irrational hatred. There is no such thing as a  phobia for a hatred that is rational.,racism,1,@Kaya786,,
5552-2049-5595-8759-68,5552-2049-5595-8759-68,That's an excuse and a cop out.  Every single Islamic nation is repressive. They produce either dictators or theocrats.,racism,1,@reza_rahman,,
5523-4646-5520-3489-92,5523-4646-5520-3489-92,"RT : Israeli spat upon, beaten by Muslims singing anti-Semitic songs in Berlin",racism,1,@dsyndergaard,,http://t.co/ursJ1GdnuK
5667-1550-1879-9100-16,5667-1550-1879-9100-16,RT : 12-yr-old sold as  slave to a 50-yr-old man said she didn't know what rape meant- only that she woke up bleeding http:…,racism,1,@EVIL_DAESH,#ISIS,
5739-4607-5041-5500-16,5739-4607-5041-5500-16,I know that the terrorist organization Hamas has not had another election since their first one.,racism,1,@congressman_aly,,
5740-0822-1569-9779-84,5740-0822-1569-9779-84,He's lying. There is nothing that ISIS does that the prophet Mohammed did not also do.,racism,1,@Superfeeder,,
5746-4445-7502-4620-16,5746-4445-7502-4620-16,The Badr brigade doesn't liberate anyone. They are simply a different flavor of Islamofascists.,racism,1,@Mohammed_UK_,,
5530-1838-4120-4220-16,5530-1838-4120-4220-16,You are talking bullshit. The information is clear that the majority of Muslims are not moderate.,racism,1,@azmoderate @JoeWSJ,,http://t.co/whdlCI8aXZ
5729-6784-4721-3809-92,5729-6784-4721-3809-92,"As usual, you are a Muslim liar making any excuses for a religion of barbarity, murder, hatred, and sexism. And now you are blocked.",racism,1,@DianH4,,
5749-1518-0875-8049-92,5749-1518-0875-8049-92,Here is the Quran telling Muslim men that they can rape their slave girls.,racism,1,@biebervalue @greenlinerzjm,,http://t.co/FyNapWCBWw
5627-1908-9479-9260-16,5627-1908-9479-9260-16,"RT : New chant outside the diwan in : ""No Tahawi, no Zarqawi, we want to execute al-Rishawi""",racism,1,@saraewilliams,#Amman,
5555-0418-5664-6309-76,5555-0418-5664-6309-76,"What is amazing is how often Allah's revelations met Mohammed desires, but no one became suspicious except Aisha.",racism,1,@banquran1 @HuwGruffydd,,
5756-3099-3484-2060-16,5756-3099-3484-2060-16,Every minority in every Muslim country is a shrinking minority due to Muslim abuse.,racism,1,@SelenaKhan14 @PTISalarKhan @georgegalloway,,
5747-8707-9609-0250-24,5747-8707-9609-0250-24,"Mohammed was a slave trader, caravan robber, murderer, beheader, rapist, sexist, bigot, liar and pedophile. Just like ISIS.",racism,1,@greenlinerzjm,,
5594-2161-5466-0990-08,5594-2161-5466-0990-08,Daesh price list for Yezidi and Christian sex slaves.,racism,1,@LifeInKhilafah,,http://t.co/H4ELrfxhSm
5749-8883-6133-9580-16,5749-8883-6133-9580-16,"Mohammed was suppose to be guided by god, and his example was for all mankind for all time. He was not suppose to follow.",racism,1,@Wonderstroke,,
5711-6562-9857-6609-92,5711-6562-9857-6609-92,"Mostly it shows how vile, inhuman, digusting, and barbaric that religion is.",racism,1,@CherguiaMbark,#Islam,
5719-1173-1343-0689-92,5719-1173-1343-0689-92,The reason why Mohammed's thugs went to war was to get what they could steal.,racism,1,@DianH4 @rogue_allah,,
5682-7312-4048-7649-92,5682-7312-4048-7649-92,The later verses abrogated the earlier verses and what remains is violent and imperialist.,racism,1,@UmarFarooq_ @FaheemHus @jackmjenkins,,
5751-8513-3679-9680-00,5751-8513-3679-9680-00,Compare a Netanyahu speech to this genocidal Palestinian lunatic.,racism,1,@alihadi68 @MaxBlumenthal @rudoren @nytimes,,https://t.co/8cmfoOZwxz
5602-9122-7166-1790-08,5602-9122-7166-1790-08,The battles were won because Mohammed gave his thugs 80% of what they stole.,racism,1,@98Halima @johnnygjokaj @cdnKhadija @BilalIGhumman @rfrankh53,,
5649-9056-4471-2800-00,5649-9056-4471-2800-00,RT :   Welcome to the Hotel Islamfornia. May check out any time but never leave.,racism,1,@PeterTownsend7,#Muslim #Islam,http://t.co/8vVkPH55DH http://…
5740-2632-9403-7319-68,5740-2632-9403-7319-68,RT : What about current slavery?    Afraid of Islam?  http:/…,racism,1,@Chris_1791,#Ferguson #blacktwitter #DontAllBlackLivesMatter,http://t.co/AN93G7q3gg
5550-1911-0904-7790-08,5550-1911-0904-7790-08,"Until we get beyond making excuses for, ""just a few bad Muslims"" and recognize Islam as a religion of terror, Paris will keep happening.",racism,1,,,
5644-9392-3616-1909-76,5644-9392-3616-1909-76,"Watching Shia Militia beat a Peshmerga to death, I thought, ""Praying to Allah 5 times a day certainly peaks the level of fanatical hatred""",racism,1,,,
5767-6549-2448-2680-32,5767-6549-2448-2680-32,Mosque that is still standing. Typical Muslim terrorist asshole.,racism,1,@AAlwuhaib1977,,
5747-3163-3200-2629-76,5747-3163-3200-2629-76,"RT :  
ONE MILLION or more illegal alien Muslim invaders set to flood into Italy and the rest of Euro…",racism,1,@TRobinsonNewEra,,http://t.co/F32WeECVnm
5645-3500-2742-8129-92,5645-3500-2742-8129-92,They are not protected under Islam.  Islam declared war on all humanity 1400 years ago.,racism,1,@SumerSloan @PAWarnhoff @etsho127,,
5741-9293-8420-3059-84,5741-9293-8420-3059-84,The majority of Muslims have already shown themselves to be radical in polls.,racism,1,@logicalmind11,,http://t.co/voEY1fspR1
5757-8592-8377-0289-92,5757-8592-8377-0289-92,Already proven that Islam abuses women &amp; I showed statistics to back it up. I'm bored with repetition.,racism,1,@halalfam @biebervalue @greenlinerzjm,,
5641-0693-8728-7100-16,5641-0693-8728-7100-16,"Islam is simply an excuse to rape, murder, loot, practice bigotry, sexism and hatred. The prophet Mohamed designed it to get thugs to follow",racism,1,,,
5558-1187-5271-6149-76,5558-1187-5271-6149-76,Every Muslim who is forced to stay in Islam by the law of apostacy for murder is forced.,racism,1,@NNdabbour64,,
5750-4817-8262-6510-08,5750-4817-8262-6510-08,"And since Islam is a religion of murder, bigotry and hatred, hating Islam is rational.",racism,1,@Kaya786,,http://t.co/yVoMfK1ytk
5525-5957-0917-1340-16,5525-5957-0917-1340-16,120 million Africans murdered by Islam,racism,1,@ibnHlophe @eeviewonders @CTFleaMarkets,,http://t.co/UYbGO0VcG7
5644-8569-4718-8899-84,5644-8569-4718-8899-84,Opinions are opinions.  Far more Jews live in western nations than where they originated.,racism,1,@Vandaliser @sajid_fairooz @IsraeliRegime,,
5633-6269-8444-8039-68,5633-6269-8444-8039-68,Following example of their prophet Muslims are still commonly marrying children. No one else is.,racism,1,@rico_hands @semzyxx @NAInfidels @owais00,,
5663-9609-3491-9989-76,5663-9609-3491-9989-76,"Furthermore, the Muslims were the last to give up slavery, and many only did it under pressure from the west.",racism,1,@discerningmumin,,
5586-9793-8701-2549-76,5586-9793-8701-2549-76,"The problem was not the communists atheism, but rather their totalitarianism, just like Islam.",racism,1,@scamp_faridxx @cameIzzz,,
5660-5715-7670-3669-76,5660-5715-7670-3669-76,Allah scewed up when he planned on Kobane. Now the free citizens of Kobane are rebuilding.,racism,1,@States_Mujahid2 @Islam4EA,,http://t.co/0wCXCzfU7M
5530-0588-7988-5880-32,5530-0588-7988-5880-32,"1/3 of the religion is ready to murder apostates.  There are no ""moderate Muslims""",racism,1,@unteenable,,http://t.co/rHENXNvhbO
5713-5616-9123-3980-16,5713-5616-9123-3980-16,There you go. You just showed why Islam is a vile and inhuman religion.,racism,1,@DianH4 @rogue_allah,,
5642-7411-8351-0119-68,5642-7411-8351-0119-68,May Allah piss on him before giving him his 72 virgin pigs.,racism,1,@abunaseeha2,,
5644-5247-0416-3470-08,5644-5247-0416-3470-08,"Go read what the Pact says, and don't waste my time.",racism,1,@Vandaliser @sajid_fairooz @IsraeliRegime,,
5670-3327-0936-6739-84,5670-3327-0936-6739-84,"You dumb asshole, he legalized slavery, he raped slave girls, he was a pedophile. How can you call him great anything.",racism,1,@shehzilk @watan71969,,
5747-5712-9271-1649-92,5747-5712-9271-1649-92,No it is the Muslims that have done the ethnic cleansing for 1400 years. Israel is putting a stop to it,racism,1,@ardiem1m @MaxBlumenthal @oldkhayyam,,
5659-3826-8265-4069-76,5659-3826-8265-4069-76,Madrassa math.  Daesh threw manpower at Kobane in far disproportion to it's size.,racism,1,@clouds789 @sergioba66 @ParaKeta,,
5750-9842-7152-8389-76,5750-9842-7152-8389-76,ROFL. Jews used to live on 40% of Arabian peninsula. Who is committing genocide against who?,racism,1,@OccuWorld,,
5617-0446-5745-4650-24,5617-0446-5745-4650-24,"A good Muslim is good despite his bad religion, not because of it.",racism,1,@SirajZarook @OdiniaInvictus @BilalIGhumman @IsraeliRegime,,
5750-6974-2152-6099-84,5750-6974-2152-6099-84,"No the Muslims murdered the Jews the traditional Muslim way, with swords, knives, and spears. And they did it for 1400 years.",racism,1,@MadDr11,,
5562-8060-6531-6540-16,5562-8060-6531-6540-16,"And of course the Palestinians are firing rockets at Israel without any regard for what they hit, including women and children.",racism,1,@yuskan0723,,
5658-8137-9653-5660-16,5658-8137-9653-5660-16,"Still, my preference is to outlaw Islam globally, not to kill all Muslims.",racism,1,@hal2012 @GerardGeorges4 @PentagonPresSec,,
5526-0285-4469-2760-32,5526-0285-4469-2760-32,...unseated the Muslims in power.  Now the Muslims are not in power either.,racism,1,@yousufpoosuf @HillaryGuess @riwired @izrinhariri @AtharHKhan,,
5527-1205-6403-9189-76,5527-1205-6403-9189-76,"RT :    The Koran preaches murder, rape, paedophillia, slavery. It's a War Manual...",racism,1,@ProudPatriot101 @PopeSweetMusic @rbassilian @Protoshiv,,
5714-8203-0535-3889-92,5714-8203-0535-3889-92,RT : Doncha love how Muslims attack then advise us that resistance to the attack is causing the attack?,racism,1,@LodiSilverado @RavenHUWolf,#TeaParty,
5746-9962-2385-3649-92,5746-9962-2385-3649-92,"RT : If christianity is banned in Muslim countries, why do we allow Islam here?

Just asking",racism,1,@disgruntledtory,,
5539-8312-7660-4129-92,5539-8312-7660-4129-92,"RT : Our political leaders are worried about offending people’s feelings.  As a result, innocent people have died!    …",racism,1,@tomesimpson,#Islam #Pa,
5650-1256-4937-9619-84,5650-1256-4937-9619-84,"Peace? You Idiot, Islam declared war on all humanity 1400 years ago. How can you blab on about peace. Time to exterminate Islam.",racism,1,@Abu_Baraa1,,
5645-9175-5081-7080-32,5645-9175-5081-7080-32,That is the fault of the terrorist who are hiding behind the women and children. Blame them.,racism,1,@etsho127 @PAWarnhoff @SumerSloan,,
5559-0851-7052-1699-84,5559-0851-7052-1699-84,"If you are just going to sit there and tell lie after lie, Muslim Taquiyya, this discussion is over. You are blocked.",racism,1,@NNdabbour64,,
5657-4422-2959-9719-68,5657-4422-2959-9719-68,"The first crusaders were Muslims, microbrain.  400 years before the Europeans headed in other direction.",racism,1,@Israelites234 @scamp_faridxx @CNN,,
5767-4214-7921-0389-76,5767-4214-7921-0389-76,It's great that you provided Arraf's name. Now I understand how these anti Semitic orgs. function.,racism,1,@AAlwuhaib1977 @dankmtl @PeaceNotHate_,,
5756-6690-5492-5409-92,5756-6690-5492-5409-92,million Muslims are extremists.,racism,1,@pNibbler @AlterNet @MaxBlumenthal,,
5634-8196-0224-2640-00,5634-8196-0224-2640-00,Mohammed was an imperialist that led 17 major military expeditions. ISIS is imperialist.,racism,1,@teddyboylocsin @tweetybird2009 @PatVPeters,,
5525-5856-2564-5340-16,5525-5856-2564-5340-16,Jews used to live on 40% of the Arabian Penninsula.  Muslims have virtually exterminated them.,racism,1,@ibnHlophe @eeviewonders @CTFleaMarkets,,
5753-1775-3441-0750-08,5753-1775-3441-0750-08,The Prophet Mohammed beheaded 600 Jews for not being loyal to him. And all the Muslims love Mohammed. So what's the problem?,racism,1,@MaxBlumenthal,,
5550-9958-8793-9989-76,5550-9958-8793-9989-76,The reason these politically correct idiots will never solve problem is because they won't acknowledge that it's Islam,racism,1,@jerZboyUSA @theblaze,,
5717-7600-6891-0330-24,5717-7600-6891-0330-24,"And there is the next thing that is wrong with Muslims, most of you are liars. 80% were killed by Taliban.",racism,1,@DianH4 @ExposeFalsehood,,
5696-2661-6185-2540-16,5696-2661-6185-2540-16,"This man is a fraud trying to convince westerners that the religion of hatred, murder,bigotry and sexism is something different",racism,1,@MrAlMubarak,,
5764-5446-9266-7349-76,5764-5446-9266-7349-76,Arabs and Muslims against the Jews.,racism,1,@PsychBarakat @PhilipMills8 @jncatron,,https://t.co/8cmfoOZwxz
5648-5718-2986-8419-84,5648-5718-2986-8419-84,"Every day we see that Muslims hate freedom, democracy, justice.",racism,1,@Qoloob4 @Vandaliser @sajid_fairooz @IsraeliRegime,,http://t.co/tDgsfthA4h
5748-0757-9630-5470-08,5748-0757-9630-5470-08,"Islam only talked about the freeing of slaves who were Muslims.Since Mohammed was a slave owner,it continued to today. Good night",racism,1,@asem_1994,,
5525-9930-9535-8339-84,5525-9930-9535-8339-84,"I guess if you call murder, rape, slavery, hatred, bigotry and sexism beautiful, then it is beautiful.",racism,1,@LLiraqi,,
5713-5820-4199-7680-00,5713-5820-4199-7680-00,"In 1400 years Islam has never produced anything other than tyrants, and the world is obligated to deal with them.",racism,1,@DianH4,,
5764-5209-2589-5800-32,5764-5209-2589-5800-32,"Then you are a total idiot, because Muslims are killing people around the globe. They are at war with every religion on earth",racism,1,@roisin_morgan,,
5766-3558-5068-0399-36,5766-3558-5068-0399-36,"No, microbrain, I'm okay with Israel doing what they have to do to stop the same extermination the Muslims have done for 1400 yrs.",racism,1,@dankmtl,,
5762-6190-6412-8760-32,5762-6190-6412-8760-32,I pray that the lying criminal bitch goes to prison.,racism,1,@samerissawi1 @MaxBlumenthal,,
5519-3544-6427-5050-24,5519-3544-6427-5050-24,RT : Norway sees huge drop crime as large number  Muslim illegals deported     …,racism,1,@Juliet777777 @FrancsPays @DutchDL @OZzSu,,http://t.co/6VBvvPWn1Q
5767-4716-9652-1629-44,5767-4716-9652-1629-44,Apartheid is a propaganda word used by terrorist supporters to further the cause of Muslim terrorism.,racism,1,@AAlwuhaib1977,,
5670-3138-7106-9720-32,5670-3138-7106-9720-32,A shit sucking Muslim bigot like you wouldn't recognize history if it crawled up your cunt.You think photoshop is a truth machin,racism,1,@watan71969,,
5634-8196-0010-3509-76,5634-8196-0010-3509-76,"Mohammed had people,who disagreed with him murdered. ISIS murders the same.",racism,1,@teddyboylocsin @tweetybird2009 @PatVPeters,,
5747-7725-4661-5950-08,5747-7725-4661-5950-08,"And by the way, the entire world hates Islam.",racism,1,@greenlinerzjm,,
5767-4354-6230-6780-16,5767-4354-6230-6780-16,"It's not Israelis that are constantly murdering Christians &amp; Hindus for blasphemy in Pakistan, it's Genocidal Muslim mobs.",racism,1,@AAlwuhaib1977,,
5609-8087-1021-6090-24,5609-8087-1021-6090-24,Yahya flips out about PKK being communists.  But that is clearly no longer true. Just propaganda.,racism,1,@harun_yahya,,http://t.co/UxQSWBGYPk
5644-6130-4019-0259-84,5644-6130-4019-0259-84,There was no Muslim golden age. Those states were always slave states.,racism,1,@Vandaliser @sajid_fairooz @IsraeliRegime,,
5530-2248-4467-8350-08,5530-2248-4467-8350-08,RT : EDITORIAL: Murderous soul of radical Islam has attacked the foundation of Western civilization  http…,racism,1,@NYDailyNews,,http://t.co/vbu2idLCCt
5711-6782-6414-6780-16,5711-6782-6414-6780-16,Saying that Islam is a way of life means that Islam actually tells you which hand to use to wipe your ass.,racism,1,@zakirnaikirf,,
5660-9898-1558-5669-76,5660-9898-1558-5669-76,"If you are a Muslim, and if you have actually read the Quran, then you have to be a total liar.",racism,1,@eS3udi @Just_Nafisa @FatimaFatwa @JRehling,,
5723-4297-8255-0490-24,5723-4297-8255-0490-24,So Drasko just said he was impressed the girls cooked half a chicken.. They cooked a whole one,racism,1,,#MKR,
