formatted_index,formatted_id,cleaned_text,Annotation,oh_label,users,hashtags,links
5767-4933-6190-5250-56,5767-4933-6190-5250-56,Muslim mob violence against Hindus in Bangladesh continues in 2014.,racism,1,@AAlwuhaib1977,#Islam,http://t.co/C1JBWJwuRc
5678-4332-0338-1249-92,5678-4332-0338-1249-92,Islamophobia is like the idea of Naziphobia. Islam is a religion of hate and it must be outlawed.,racism,1,@jncatron @isra_jourisra @AMPalestine,,
5646-0409-0752-0609-92,5646-0409-0752-0609-92,Islam invaded and conquered 2/3 of Christiandom before any Christian crusades in response. The writer is a liar.,racism,1,@HuffPostRelig,,
5633-6995-6734-0300-16,5633-6995-6734-0300-16,"Do you approve of your pedophile prophet raping a 9 year old girl, like it says in 7 hadith?",racism,1,@semzyxx,,
5669-8397-0571-5790-08,5669-8397-0571-5790-08,Problem with vile Muslims is that they try to rationalize &amp; excuse the crimes of Islam rather than get rid of them.,racism,1,@watan71969 @geeky_zekey,,
5573-7972-4544-9749-76,5573-7972-4544-9749-76,You are following the religion of ignorance with an illiterate prophet and you want to talk about spelling? LOL.,racism,1,@Ammaawah @jm111t,,
5627-1978-9815-4560-00,5627-1978-9815-4560-00,True. Stoning and beheading were much more to Mohammed's taste.,racism,1,@hahellyer,,
5642-7763-0275-3059-84,5642-7763-0275-3059-84,Have they told the tribe yet that their daughters would become whores for sexual jihad?,racism,1,@abunaseeha2,,
5641-7904-1981-1859-84,5641-7904-1981-1859-84,"Furthermore, telling people that they should be tolerant of a wholly intolerant religion is idiotic.",racism,1,@MaDaSaHaTtEr_17 @buttercupashby,,
5743-1314-9769-2490-24,5743-1314-9769-2490-24,Quran 8.12 would be a good example of terrorism.,racism,1,@ummsuhaym @logicalmind11,,http://t.co/vonYOAtpfk
5518-1201-6768-1720-32,5518-1201-6768-1720-32,RT : I've been called an Islamophobe for saying Islam needs a theological reformation. Now the head of Egypt agrees:,racism,1,@IAMMGraham,,http://t.co…
5552-2075-2186-6099-84,5552-2075-2186-6099-84,You are basically claiming that a religion that teaches hatred and murder has nothing to do with hatred and murder. Dumb!,racism,1,@reza_rahman,,
5558-2526-7801-7269-76,5558-2526-7801-7269-76,"I am better. I have no problem with Hinduism, Christianity, Tao, Judaism, Buddhism or atheism. But Islam hates all non-Muslims.",racism,1,@NNdabbour64,,
5644-6602-2527-1480-32,5644-6602-2527-1480-32,"Notice how most of the contributions are from Persians, not Arabs, and are despite Islam.",racism,1,@Vandaliser @sajid_fairooz @IsraeliRegime,,
5767-5211-2379-4370-56,5767-5211-2379-4370-56,I think your Muslim friends are raping girls around the world.,racism,1,@MaxBlumenthal @Ajzionts,,http://t.co/liSKP9U8Uq
5745-8790-9107-3760-00,5745-8790-9107-3760-00,Muslim bigots constantly create confrontations and then whine to the world about results.,racism,1,@RaniaKhalek @MaxBlumenthal @NickKristof,,
5747-7873-0125-5089-92,5747-7873-0125-5089-92,"Fuck . Mohammed was a pedophile, murderer, bigot, sexist, rapist, slave trader, caravan robber, and liar.",racism,1,@freemedialive,#Islam,
5674-7704-2166-2640-00,5674-7704-2166-2640-00,The parallel between the behavior of terrorist organizations and the prophet Mohammed is something I've preached for 15 year,racism,1,@RichardDawkins,,
5688-3272-2547-8389-76,5688-3272-2547-8389-76,"We don't support tyrants, Islam produces nothing but tyrants.  All the Caliphs and Sultans were tyrants.",racism,1,@DianH4 @ExposeFalsehood,,
5755-0904-3445-3009-92,5755-0904-3445-3009-92,"Yes, I'm hoping we can get the Muslims to stop oppressing Jews and Christians and Hindus and Buddhists.",racism,1,@CherguiaMbark,,
5659-0713-8501-8040-32,5659-0713-8501-8040-32,The ground drone will be bullet proof and carry small rockets to intercept RPGs.,racism,1,@DawlatnaMansura,,
5646-3164-4879-8469-76,5646-3164-4879-8469-76,"These days might and honor come from science, technology, humanitarianism. Which is why Muslims won't get any.",racism,1,@Rayandawlah_ @_Jihad10,,
5648-8481-3375-4960-00,5648-8481-3375-4960-00,"And while Christianity moved past it's barbarity, Islam keeps returning to it.",racism,1,@Qoloob4 @Vandaliser @sajid_fairooz @IsraeliRegime,,
5756-5063-0536-0359-68,5756-5063-0536-0359-68,"No, the Muslims worldwide are the problem. Israel is protecting itself against the same Muslim persecution that is global.",racism,1,@congressman_aly,,
5670-3460-7468-4170-24,5670-3460-7468-4170-24,"I'm talking total extermination, bragged about right there in the book.",racism,1,@edgeofthesandbx @batchelorshow @FearDept,,
5744-2234-3956-5699-84,5744-2234-3956-5699-84,"If someone is going to die getting ISIS out of , it may as well be the Shia militia.  That is all good.",racism,1,,#Tikrit #Islam #Daesh,
5749-3390-6824-1269-76,5749-3390-6824-1269-76,I don't trust ISIS or the Shia militia. Both want to force their sick religion on people.,racism,1,@BinMaymun @stevoiraq,#Tikrit,
5516-5962-7872-4160-00,5516-5962-7872-4160-00,I love how the Islamofascists recruit 14 and 15 year old jihadis and then talk about minors in reference to 17 year olds.,racism,1,@lauracdean,,
5678-4303-3418-3219-84,5678-4303-3418-3219-84,Wrong. They were connected to the Muslim Brotherhood and they were anti Semitic bigots.,racism,1,@jncatron @isra_jourisra,,
5523-1330-4358-8469-76,5523-1330-4358-8469-76,The command to fear Allah is all through the Quran.  The ritual of groveling on the ground is one of fear. No personal relationship,racism,1,@Nigzzzk,,
5673-6520-6615-9329-92,5673-6520-6615-9329-92,Erdogan is a fascist Islamist scum bag. Women's employment has decreased 30% under him. Violence against women has increased.,racism,1,@ZamiraTwitt,,
5522-5807-2148-5820-16,5522-5807-2148-5820-16,"Because they breed like rats, kill non Muslims, and force religion on people by the sword.",racism,1,@ummayman90,,
5530-1100-6297-7390-08,5530-1100-6297-7390-08,Nobody cares what his honor means to you fools.  We have no obligation to honor the slave trader and caravan robber.,racism,1,@anjemchoudary,,
5740-1101-5811-1050-24,5740-1101-5811-1050-24,"That's because it's all about the barbarity of Islam, not the beards.",racism,1,@QrysBinThynkn,,
5551-9655-9076-6549-76,5551-9655-9076-6549-76,"Name the last person the KKK killed, and you can find 100,000 that have since been killed by Islamists.",racism,1,@SumbelinaZ @IronmanL1 @Hatewatch,,
5641-2692-5430-3539-84,5641-2692-5430-3539-84,RT :  using retarded kids as suicide bombers is nothing new. When I was in Ramadi they rolled one in a wheelchair at us. Ha…,racism,1,@PatDollard,#ISIS,
5559-0691-9169-1429-76,5559-0691-9169-1429-76,Islam is about as perfect as Nazism.,racism,1,@KamelNasrEldien,,
5527-1479-3791-2709-76,5527-1479-3791-2709-76,Why would I read lies about what Islam is when I can see what it is in the Quran and Hadiths?,racism,1,@hu_4u,,
5530-7621-1878-8709-76,5530-7621-1878-8709-76,RT :  Same MSM that insists Islam has no connection w/terror censors cartoons cuz they fear being murdered. S…,racism,1,@SmokeNMirrors71 @AceofSpadesHQ,,
5702-9576-8868-8849-92,5702-9576-8868-8849-92,But the pedophile prophet Mohammed only cared about his pecker and his perverted desires.,racism,1,@DianH4 @ExposeFalsehood,,
5750-4320-5231-6120-32,5750-4320-5231-6120-32,Every Muslim convert becomes Muslim propaganda.,racism,1,@CherguiaMbark,,
5685-4878-8559-6789-76,5685-4878-8559-6789-76,"Chapel Hill is not surprising. What is surprising is that given the level of Islamic terrorism, there is so little.",racism,1,@omarsuleiman504 @asimb,,
5663-9665-3679-0300-16,5663-9665-3679-0300-16,"And now, every Jihadi group wants to reinstate slavery in the present because the Quran approves it and Mohammed practiced.",racism,1,@discerningmumin,,
5650-1202-4225-0629-76,5650-1202-4225-0629-76,Wheras Islam simply declared war on all humanity 1400 years ago and has never stopped. Time to return the favor,racism,1,@nebula_chain_ @PaulStephen8,,
5594-1826-9149-2990-08,5594-1826-9149-2990-08,You can't even imagine how I think because I cannot imagine how anyone would take such a vile religion as Islam.,racism,1,@LifeInKhilafah,,
5646-3660-1397-9610-24,5646-3660-1397-9610-24,Muslims have these delusions about producing Algebra. But many others beat them to it.,racism,1,@_Jihad10 @Rayandawlah_,,http://t.co/AsMiQZFvAG
5592-2394-0115-9930-24,5592-2394-0115-9930-24,"RT : Theresa May today pleaded with  not to leave. Jews build wealth, Muslims take welfare. Simple economics.",racism,1,@Greg389,#Jews,http://t.co/lvaN…
5685-4654-3055-1589-76,5685-4654-3055-1589-76,"And not only did Mohammed burn them, the crucified, stoned and beheaded people.",racism,1,@KellyTurner99 @buellerishere @isra_jourisra @fei989,,
5749-1272-1524-6830-08,5749-1272-1524-6830-08,"Horseshit. Mohammed led 17 major military expeditions, owned 28 slaves, had 9 wives - one six years old.",racism,1,@biebervalue @greenlinerzjm,,
5679-3951-2812-2449-92,5679-3951-2812-2449-92,"Saudi cleric: ""sun revolves around the earth."" Now you can understand why madrassa graduates have no skill but Jihad.",racism,1,,#Islam #science,
5761-1355-8032-8920-32,5761-1355-8032-8920-32,About 90% of Iraqi civilians are killed by Muslims.,racism,1,@mutaSawwif,,
5762-5719-7484-5560-32,5762-5719-7484-5560-32,Another taqiyya liar making up garbage for the sake of  Mohammed's desire to exterminate Jews.,racism,1,@RaniaKhalek @MaxBlumenthal,,
5563-5228-7204-1959-68,5563-5228-7204-1959-68,The filthy Palestinians have attacked and murdered Jewish children in their schools in the past.  So fuck Palestinians.,racism,1,@yuskan0723,,
5591-0638-7545-1820-16,5591-0638-7545-1820-16,"The prophet Mohammed used catapults on cities, killing women and children. So you just called him a coward.",racism,1,@_Ibn_Latif @Colonel_Shami,,
5573-6108-4294-6309-76,5573-6108-4294-6309-76,That's only because they don't follow Islam.  Islam tells women to stay at home.,racism,1,@Ammaawah @jm111t,,http://t.co/UQLoWj1GjS
5559-0893-0576-9900-16,5559-0893-0576-9900-16,"True, no other ideology is as vile, murderous, backwards and stupid as Islam.",racism,1,@KamelNasrEldien,,
5740-1523-1313-1130-24,5740-1523-1313-1130-24,"RT : CNN reports on the murders of homosexuals by the Islamic State, but the problem isn’t just ISIS, it’s Islam",racism,1,@4chunat1,,http://t.co/ocd3R…
5635-7729-0127-1840-00,5635-7729-0127-1840-00,The ME led the world in development before there was Islam and fell behind the world after Islam.,racism,1,@obsurfer84,,
5526-2147-2418-8899-84,5526-2147-2418-8899-84,We could deal with the violent fanatics if the texts of Islam weren't producing more.,racism,1,@P_Valerianus @CTFleaMarkets @ibnHlophe @eeviewonders,,
5617-1611-6917-9770-24,5617-1611-6917-9770-24,"Scandinavian people will not be displaced by Jews, they'll be displaced by Muslim",racism,1,@OdiniaInvictus @SirajZarook @BilalIGhumman @IsraeliRegime,,
5660-0642-9903-9050-24,5660-0642-9903-9050-24,RT : AUSTRALIA: Lebanese Muslim husband 12-year-old pregnant wife arrested  sexual abuse   http…,racism,1,@Juliet777777,#PATRIOTS,http://t.co/SVYLP1qcDP
5626-6636-4939-1409-92,5626-6636-4939-1409-92,Obviously you know nothing about your religion.  Permission to rape slave girls is in both Quran and Hadiths.,racism,1,@aliabdalhamid @izrinhariri,,
5763-5440-3482-8780-16,5763-5440-3482-8780-16,And of course you are campaigning for the destruction of the Israelis because you are a racist anti-Semite asshole.,racism,1,@jncatron,,
5528-5691-5353-8250-24,5528-5691-5353-8250-24,Notice how the news media avoids pointing out that the murderers of the 12 French are followers of the death cult of .,racism,1,,#Islam,
5670-7372-9054-6380-16,5670-7372-9054-6380-16,"Mohammed was a slave trader, Jesus wasn't.  Mohammed was a sexist, Jesus wasn't.",racism,1,@truaemusic @mattybboi83 @Number10gov,,
5670-8110-2095-8350-08,5670-8110-2095-8350-08,"A religion who has a murdering, hating pedophile at it's core has no room to be reformed.",racism,1,@truaemusic,,
5720-7609-1470-3029-76,5720-7609-1470-3029-76,Then why do you smelly rag heads keep moving to Britian?,racism,1,@ummahwitness,,
5523-0452-1637-2860-16,5523-0452-1637-2860-16,Here is how  inscribes the inferiority and abuse of women.,racism,1,@ilhaam673 @B1236M,#Islam,http://t.co/wXassJMkTd
5755-0820-8212-5619-84,5755-0820-8212-5619-84,Fighting for him would mean not forcing him to become a jihadi hate monster.,racism,1,@santafeez,,http://t.co/tFmpcH1aZH
5525-3218-1038-6860-16,5525-3218-1038-6860-16,"RT : Look at all the land occupation in green, of ""Islamic domination"". We are being duped.",racism,1,@riwired @jemfleming @GOP @VileIslam,,http://t.c…
5750-9142-0140-1509-76,5750-9142-0140-1509-76,"If they were aligned with neo Nazis, the Muslims would love them.",racism,1,@Hesiod2k11 @MaxBlumenthal @BlueDuPage,,
5749-2083-3459-5969-92,5749-2083-3459-5969-92,"You fucking moron, slavery is approved right in the Quran. Read it you stupid idiot.",racism,1,@biebervalue @greenlinerzjm,,
5747-5769-6303-3169-92,5747-5769-6303-3169-92,Forget about your anti Jewish bigotry. How do you explain Hamas beheading gays and honor killing women,racism,1,@ardiem1m @MaxBlumenthal @oldkhayyam,,
5766-1364-2910-5730-56,5766-1364-2910-5730-56,What Christian who is not insane would want to live under Sharia law?,racism,1,@dankmtl @PeaceNotHate_,,
5750-8910-6029-4289-92,5750-8910-6029-4289-92,RT : “The lofty status of women in : Woman's testimony ½ the weight of a man's.”   http:…,racism,1,@AnneBayefsky,#Islam #WomensDay,http://t.co/cSIckyEr8T
5635-4504-8520-7450-24,5635-4504-8520-7450-24,Even your own link shows that the Jews were the producers and the Muslims lived by stealing others property.,racism,1,@obsurfer84,,
5681-0693-0054-3649-92,5681-0693-0054-3649-92,"RT : Saudi Arabia sewer qurans. When you can't express your hatred for Islam in words, throw them in the sewer.",racism,1,@God_Equals_Sant,,http://t.co…
5525-3094-8496-3180-16,5525-3094-8496-3180-16,Who is justifying Christianity microbrain. I don't have a religion. Why are you hiding Islamic barbarity,racism,1,@HillaryGuess @riwired @izrinhariri,,
5552-0146-1488-2179-84,5552-0146-1488-2179-84,The Department of Justice report says blacks kill at 6 times the rate of whites.,racism,1,@JosephIsVegan @SumbelinaZ @IronmanL1 @Hatewatch,,
5533-6096-0438-5630-08,5533-6096-0438-5630-08,"Mohammed led 17 major military expeditions.  Most offensive.  He raped, robbed, murdered, lied, slaved, and was a pedophile.",racism,1,@SevilZadeh,,
5603-1148-0457-7649-92,5603-1148-0457-7649-92,ISIS has slavery because the prophet Mohammed was a slave owner and trader.,racism,1,@98Halima @BilalIGhumman @johnnygjokaj @cdnKhadija @rfrankh53,,
5744-2341-3579-6490-24,5744-2341-3579-6490-24,"RT : Gang-raped Saudi woman gets 200 lashes, jail time. Saudis on UN ""Human Rights"" Council.",racism,1,@AnneBayefsky,,http://t.co/et8DDsmTrp http://t.c…
5517-8771-7168-6200-32,5517-8771-7168-6200-32,Muslims are fighting with every religion and none religion on the face of the earth.  But we are suppose to believe it's Jews fault,racism,1,@REMY119,,
5754-7549-0250-6170-24,5754-7549-0250-6170-24,And the lying Muslims claimed that all of their attacks were only done because they were preemptive.,racism,1,@harmlesstree2,,
5682-4001-1490-9100-16,5682-4001-1490-9100-16,"RT : ""Muslim Americans feel they've been targeted” - Obama

No mention of Jews, victims 60% of the time (h/t ) http:…",racism,1,@Cameron_Gray @joelengel,,
5603-1890-8612-0960-00,5603-1890-8612-0960-00,Raping children is what Mohammed did.,racism,1,@cdnKhadija @johnnygjokaj @BilalIGhumman @98Halima @rfrankh53,,
5525-5935-8643-4170-24,5525-5935-8643-4170-24,That Hadith is specific to AP.  Many others are specific to war on non believers everywhere.,racism,1,@ibnHlophe @eeviewonders @CTFleaMarkets,,
5678-1521-0959-9089-92,5678-1521-0959-9089-92,The Saudis will arm Sunni rebels in Yemen. Civil war is inevitable.,racism,1,@Joyce_Karam,,
5766-0681-3107-3309-44,5766-0681-3107-3309-44,Mohammed was a genocidal bigot who attacked Jews and Christians. ISIS and Hamas do exactly the same.,racism,1,@MaxBlumenthal @mehdirhasan @tnr,,
5602-9392-6502-8140-16,5602-9392-6502-8140-16,RT :   ? I think the word you're searching for is,racism,1,@PeterTownsend7,#isis #muslim #Islamophobia #Islamorealism,http://t.co/NyihT8Bqyu http://t.c…
5660-0561-8905-8659-84,5660-0561-8905-8659-84,RT :   Why beheadings? Because it's in the book!,racism,1,@PeterTownsend7,#Islam #ISIS,http://t.co/CcVAw1M7LF http://t.co/CGDLnBIbkK
5696-8794-3452-8199-68,5696-8794-3452-8199-68,There are many supposed Americans that work to destroy America.,racism,1,@Nick_d_Williams,,
5658-8731-2291-0579-84,5658-8731-2291-0579-84,Oh good. That get's them out from behind the civilians so that the Peshmerga can kill them.,racism,1,@TheInfoIslam,,
5670-3082-7360-3299-84,5670-3082-7360-3299-84,"Yeah, I know. Being a human being is against Islam. Islam must be outlawed.",racism,1,@ILTAFSHEHZAD,,
5660-5461-3879-5050-24,5660-5461-3879-5050-24,When you wake up tomorrow you will find that Daesh reports were as real as your 72 virgin pigs.,racism,1,@golddinar1 @uygaraktas @Islam4EA,,
5670-8087-1472-0170-24,5670-8087-1472-0170-24,The followers of the religion give a shit about the prophet of the religion. He is their example and always will be.,racism,1,@truaemusic,,
5763-5302-6547-3930-24,5763-5302-6547-3930-24,And while all other religious groups globally are under genocidal attacks by Muslims you blame the Jews.  Utterly  stupid.,racism,1,@roisin_morgan,,
5634-8190-7992-5969-92,5634-8190-7992-5969-92,Mohammed was a caravan robber.  ISIS steals others property.,racism,1,@teddyboylocsin @tweetybird2009 @PatVPeters,,
5620-4905-2154-4010-24,5620-4905-2154-4010-24,"RT : Pakistan is a nation of haters, killers and savages. See this  tweet. Barbarism is in the masses' minds.",racism,1,@sudixitca @Razarumi,,http://t.c…
5641-7935-6356-8540-16,5641-7935-6356-8540-16,"I already brought you proof straight from my Qurans. If you refuse to read it, then shut up and leave.",racism,1,@buttercupashby @MaDaSaHaTtEr_17,,
5740-1872-2202-9390-08,5740-1872-2202-9390-08,"Muslims train babies to hate and murder, then use them for propaganda.",racism,1,@Col_Connaughton,,http://t.co/c7DlwIXjPc
5767-4624-3214-3439-36,5767-4624-3214-3439-36,And Muslims are murdering raping and forcefully converting Christians in Egypt and have been for centuries.,racism,1,@AAlwuhaib1977,,
5648-8797-9252-9290-24,5648-8797-9252-9290-24,"Yes, Jews are tired of being murdered by Muslims. So what?",racism,1,@Qoloob4 @Vandaliser @sajid_fairooz @IsraeliRegime,,
5548-5523-8822-1340-16,5548-5523-8822-1340-16,You and your religious brothers are the real filth of the earth. PKK rescued Yezidis from your animal friends.,racism,1,@harun_yahya,,
5754-6270-1217-9029-76,5754-6270-1217-9029-76,The Arabian Peninsula was once full of Jews and Christians. They were decimated by the Muslims. Max is helping them finish it,racism,1,@MaxBlumenthal,,
5719-1369-5191-6460-16,5719-1369-5191-6460-16,"LOL. First you deny that Islam permits the rape of slave girls, then you verify it. Get lost. I'm tired of you.",racism,1,@DianH4,,
5720-6213-5901-0320-00,5720-6213-5901-0320-00,Good. Anything is better than having Islamofascists in power.,racism,1,@Beltrew @iyad_elbaghdadi,,
5767-4300-8114-0610-56,5767-4300-8114-0610-56,And of course Christians all over the world are oppressed daily by Muslim bigotry.,racism,1,@AAlwuhaib1977 @dankmtl @PeaceNotHate_,,
5744-7020-4731-7200-00,5744-7020-4731-7200-00,So now you Taquiyya liars deny what is explicit in the Quran.,racism,1,@YusufPeaceful @Clashoftherats @tummala82 @IndyVoices,,http://t.co/u1r2GhUon9
5536-3213-2346-5560-32,5536-3213-2346-5560-32,"The idea about all of these ""moderate"" Muslims is oversold.  Most are extremists.",racism,1,@CamilleHughes16 @_Watch_Observe_,,http://t.co/cQJ6cNdGow
5551-5686-6561-3639-68,5551-5686-6561-3639-68,Objecting to this is what the PC morons of Salon call racism.,racism,1,@Salon @TheMuslimGuy,,http://t.co/pEPfxlLKfu
5713-5696-8280-9610-24,5713-5696-8280-9610-24,.....80% of Afghan civilians are killed by Taliban. So it is a service to mankind to bomb the Taliban.,racism,1,@DianH4 @ExposeFalsehood,,
5592-3172-0801-5950-08,5592-3172-0801-5950-08,Islam killed it.,racism,1,@drazmat22,,
5533-5977-7930-0270-08,5533-5977-7930-0270-08,This is a more complete picture of the bigotry of Islam than your selective lie.,racism,1,@KhaledHamaki,,http://t.co/raGDag6tmL
5622-5167-4861-8469-76,5622-5167-4861-8469-76,The Muslims are out of control and determined to steal the last tiny piece of land left to the Jews,racism,1,@nyc2peach @sajid_fairooz @IsraeliRegime,,
5758-2313-6412-6970-24,5758-2313-6412-6970-24,In fact many Muslim countries have the same odious laws as Daesh. This shows sex slaves are approved in KSA.,racism,1,@sweden,,http://t.co/rlwz0BqUBs
5641-7000-1771-2700-16,5641-7000-1771-2700-16,The fact is that Mohammed was every bit as vile and sick as ISIS. He is their model.,racism,1,@buttercupashby @MaDaSaHaTtEr_17,,
5539-4663-1289-4670-08,5539-4663-1289-4670-08,"Obviously the driving meme of Islam is world domination, if it be by force, intimidation, or persuasion.",racism,1,@KhaledHamaki,,
5766-0020-5237-1910-40,5766-0020-5237-1910-40,We are in an era where everyone has come to understand what the real  is all about.,racism,1,,#Islam,http://t.co/evEtQqChxZ
5559-1685-4599-1020-16,5559-1685-4599-1020-16,Saudi Arabia - a nation of Islamolunatics hiding from the Islamolunatics they helped to create.,racism,1,@GENUG @TheMuslimIssue,#Islam,
5684-7911-8716-7640-32,5684-7911-8716-7640-32,RT : Muslim found guilty of plotting to behead British soldiers-cases like this need the death penalty,racism,1,@DavidJo52951945,,http://t.co/Yc4rO5UU…
5623-4018-3647-8670-08,5623-4018-3647-8670-08,And I'm not sure how you can yammer about homelessness when Muslims are still murdering people for apostacy and blasphemy.,racism,1,@UmarMal,,
5553-8646-5434-0830-08,5553-8646-5434-0830-08,You are lying. Most Muslims are still extremists.,racism,1,@LibyaLiberty @SumbelinaZ,,http://t.co/u7L1uPRN7L
5587-7483-9398-2439-68,5587-7483-9398-2439-68,RT : The next successor to the Saudi throne will be the son of a slave girl,racism,1,@ThePoliticalHat,,http://t.co/C1XmXLtLXQ http://t.co/WtDeBOE1HA
5527-0309-0038-9479-68,5527-0309-0038-9479-68,"The prophet Mohammed was a terrorist, and he knew Islam.",racism,1,@hu_4u,,
5617-0972-0092-6970-24,5617-0972-0092-6970-24,I know about Judaism.  I don't recommend it.  But most Jews are secular.,racism,1,@OdiniaInvictus @SirajZarook @BilalIGhumman @IsraeliRegime,,
5558-1306-9545-1610-24,5558-1306-9545-1610-24,And all the hatred was started by your pedophile prophet.  Now you are finally getting it back.,racism,1,@NNdabbour64,,http://t.co/L8VgSNBDQX
5767-4691-1232-7089-92,5767-4691-1232-7089-92,"Wrong again, it is the Muslims murdering the Hindus in India, Kashmir, Bangladesh, and Pakistan.",racism,1,@AAlwuhaib1977,,
5521-7826-7927-8840-32,5521-7826-7927-8840-32,Imam's who disagree with Jihad are attacked by Muslims.  So where are these moderate Muslims?,racism,1,,#Islam,http://t.co/hkh5tyEIej
5622-4754-4076-3950-08,5622-4754-4076-3950-08,Yes they are Jew hating barbarians.,racism,1,@sajid_fairooz @IsraeliRegime,,
5743-2526-4085-1850-24,5743-2526-4085-1850-24,Liar. Those Hadith come from the USC Muslim student association Hadith web site. And here is more.,racism,1,@Clashoftherats,,http://t.co/v9w4T4izgk
5525-5341-0218-5569-92,5525-5341-0218-5569-92,It's called execution or conversion at sword point.  You're welcome.,racism,1,@yousufpoosuf @HillaryGuess @riwired @izrinhariri @AtharHKhan,,
5722-5333-0656-7889-92,5722-5333-0656-7889-92,These campaigns are all lies that try to portray Islam to the West as being the exact opposite of what it really is - barbaric.,racism,1,@CTVToronto,,
5651-8544-5584-0440-32,5651-8544-5584-0440-32,"RT : Authorities will use anti Semitic attacks on twitter by Muslims and the left to introduce laws against hate speech ,re…",racism,1,@royalmarine1980,,
5766-0489-2283-8100-48,5766-0489-2283-8100-48,wants women to stay in their houses and cover themselves. ISIS makes sure that they do.,racism,1,@MaxBlumenthal @mehdirhasan,#Islam,
5685-5967-2971-4979-84,5685-5967-2971-4979-84,They are always hot air. But sometimes their hot air aligns with their prophets.,racism,1,@KellyTurner99 @buellerishere @isra_jourisra @fei989,,
5634-8287-7468-2419-84,5634-8287-7468-2419-84,Right. Every Pres in history has been heavily criticized. But doing it to Obama has to be racist.,racism,1,@VannCastro @tweetybird2009 @PatVPeters,,
5593-6269-8454-9210-24,5593-6269-8454-9210-24,But Islam puts out the light and makes life too dark to bear.,racism,1,@anjemchoudary,,
5754-3106-4908-2469-76,5754-3106-4908-2469-76,"Why, when he could be elected mayor of Peshwar in a heartbeat. He could then murder Christians for blasphemy.",racism,1,@MrInsaf @georgegalloway,,
5750-6392-0362-1600-00,5750-6392-0362-1600-00,Your people's struggle is to dominate other people through violence. So fuck you.,racism,1,@MadDr11 @MaxBlumenthal,,
5766-0040-3116-0569-60,5766-0040-3116-0569-60,RT : 2011 Article: Islamists on Welfare: Paid to Plot the West's Demise,racism,1,@RavenHUWolf,,http://t.co/1ZGKuOzJqN http://t.co/G7HYxICNKt
5525-2706-4159-7690-24,5525-2706-4159-7690-24,But the fact that Islam is a declaration of war means that Islam will always produce terrorists.,racism,1,@yousufpoosuf @RKingLive2Dance @izrinhariri,,
5740-0055-8165-5120-00,5740-0055-8165-5120-00,"No matter how desperately race baiting trash like you want Islam to be a race, it's not.",racism,1,@MaxBlumenthal @CarolineFourest,,
5517-8702-7725-7050-24,5517-8702-7725-7050-24,Israel is only trying to defend itself against murderous Muslims trying to wipe it out. UN votes by Muslim nations mean nothing.,racism,1,@REMY119,,
