formatted_index,formatted_id,cleaned_text,Annotation,oh_label,users,hashtags,links
5751-3518-5492-0460-16,5751-3518-5492-0460-16,"These Muslims are babies are trained to kill, scum.",racism,1,@nader_haq @MadDr11 @MaxBlumenthal,,http://t.co/jaWq72xkfF
5588-4565-4248-6119-68,5588-4565-4248-6119-68,"What is wrong with that, considering how the Sunni Arabs have been exterminating everyone else for 1400 years.",racism,1,@aymannathem,,
5747-8140-2157-1630-08,5747-8140-2157-1630-08,"People were making scientific discoveries, including Algebra, before Islam.",racism,1,@asem_1994,,
5670-1253-5627-3130-24,5670-1253-5627-3130-24,"As usual, he will say that Islamist terrorism has nothing to do with Islam.",racism,1,@michellemalkin @TwitchyTeam,,
5685-8811-1430-5779-84,5685-8811-1430-5779-84,The Muslim citizens of Raqqa enjoying a peaceful day of beating three men to death.,racism,1,@buellerishere @KellyTurner99,,http://t.co/ki4tdL3IDR
5552-0258-9420-4250-24,5552-0258-9420-4250-24,"So, are people who support murder for apostacy guilty of anything?",racism,1,@IAmThe1Teacher @IronmanL1 @stevecorrales80,,http://t.co/KmrPOXcoGa
5749-1309-4016-6099-84,5749-1309-4016-6099-84,Mohammed had people murdered who disagreed with him. He raped women. He married a 6 year old. He beheaded Jews.,racism,1,@biebervalue @greenlinerzjm,,
5645-9230-9698-7120-00,5645-9230-9698-7120-00,I made ISIS rise? What are you talking about. Islam created that monster.,racism,1,@etsho127 @SumerSloan @PAWarnhoff,,http://t.co/Q87IjKbd7q
5767-5177-6046-5760-00,5767-5177-6046-5760-00,Max Blumenthal's Muslim friends busy raping Christian girls around the world.,racism,1,@MaxBlumenthal @Ajzionts,,http://t.co/liSKP9U8Uq
5551-5400-4989-0549-76,5551-5400-4989-0549-76,Do the BB brains at Salon understand that the rape of slave girls was approved and practiced by Mohammed.,racism,1,@Salon @TheMuslimGuy,#Islam,
5570-3697-8785-3619-84,5570-3697-8785-3619-84,The idea that no go zones are a right wing boogie man is stupid.  No go zones are real.,racism,1,@okieatheist @EWErickson,,
5753-1595-0154-5760-00,5753-1595-0154-5760-00,"With Muslims attacking European Jews and grooming European children, get rid of them.",racism,1,@NafeezAhmed @MaxBlumenthal @Number10gov,,
5736-2863-7921-9850-24,5736-2863-7921-9850-24,The apharthide is a Muslim thing. They have exterminated Jews and Christians in most of ME.,racism,1,@MaxBlumenthal @FAIRmediawatch,,
5747-5118-1748-0519-68,5747-5118-1748-0519-68,"Hamas does, however, throw their political opponents off roof tops.",racism,1,@MaxBlumenthal @mami_mermelada @GrahamDavidA @JeffreyGoldberg,,
5696-6504-3173-7610-24,5696-6504-3173-7610-24,"I don't have a ""book"". I have several hundred books. Here is a couple that expose the vileness of Islam.",racism,1,@zh_ha89,,http://t.co/dnKmh61Rl9
5570-2527-6790-4400-00,5570-2527-6790-4400-00,"Look at the data dipwad, 2/3 want sharia law, which denies all rights to women and non Muslims.",racism,1,@PoliticalAnt,,http://t.co/7QupIMBaN7
5528-7250-8995-5550-08,5528-7250-8995-5550-08,Your sadness is exactly what the terrorists want.,racism,1,@AnnaMainwaring1,,
5746-5738-0039-8320-00,5746-5738-0039-8320-00,Every border that Islam shares with every other religion is bloody. But we are suppose to believe it's the Jews fault.,racism,1,@MaxBlumenthal,,
5633-6381-5702-5530-24,5633-6381-5702-5530-24,"Hey, idiot! You can't use the problems of Judaism to justify the barbarity of the Quran.",racism,1,@rico_hands @NAInfidels @semzyxx @owais00,,
5624-2425-9780-1740-16,5624-2425-9780-1740-16,Maybe you should encourage more Jewish girls to marry black men to show how you are open minded.,racism,1,@ameytahl @buberzionist @MJayRosenberg,,
5689-4025-8307-3870-08,5689-4025-8307-3870-08,Muslims raise their children on hate.,racism,1,,,http://t.co/D0rEi7OLAO
5751-7492-5754-8960-00,5751-7492-5754-8960-00,"Blumenthal's silence on Muslim bigotry, and it's cost.",racism,1,@MaxBlumenthal @NYTOpinionator @Volker_Beck,,
5594-6287-8596-8579-84,5594-6287-8596-8579-84,You must be really young and ignorant if you think a few bombing runs are going to cause anyone to miss a meal. LOL.,racism,1,@LifeInKhilafah,,
5767-5907-4630-4309-76,5767-5907-4630-4309-76,"Max asks as his Palestinian friends are beheading gays, doing honor killings, driving Palestinian Christians out of existence",racism,1,@MaxBlumenthal,,
5650-0830-4783-3809-92,5650-0830-4783-3809-92,The inmates of Aushwitz didn't fire rockets at anyone. And the Muslims loved the Nazis.  Fail!,racism,1,@ibnabdulmajid,,
5555-3591-4437-3130-24,5555-3591-4437-3130-24,The mess was there long before the US. The entire history of Islam is murder,racism,1,@_enzk @SumbelinaZ @IronmanL1 @Hatewatch,,http://t.co/n0oXQ2kkUb
5685-4630-4923-5500-16,5685-4630-4923-5500-16,It's all hot air. Mohammed clearly burned people as shown by the Hadith I gave you.,racism,1,@KellyTurner99 @buellerishere @isra_jourisra @fei989,,
5635-1651-7279-4659-84,5635-1651-7279-4659-84,It's a guide for nothing. It's Islam's claims of the laws of god.  And Islam's god is a terrorist. Islam's prophet too.,racism,1,@obsurfer84 @teenage,,
5644-8795-5855-5729-92,5644-8795-5855-5729-92,"RT : Video supposedly showing Shia militia killing a solider calling him ""kaka"" which means Mr in Kurdish has gone viral among …",racism,1,@Amoka,#Kurdi,
5540-6964-4081-1320-32,5540-6964-4081-1320-32,I read the Quran. It is a hate mongering piece of filth.,racism,1,@depressedfuck1 @CompoundMixture @CruisingBye,,http://t.co/4j6z8JnH5j
5631-7368-0268-5909-76,5631-7368-0268-5909-76,"Our journalists watch ISIS burn a man in a cage, and they respond with the same tired cliche about ""hijacking the religion"" BS! It's",racism,1,,#Islam,
5755-4851-3012-0229-76,5755-4851-3012-0229-76,Mohammed led 17 major military expeditions that killed tens of thousands. Jesus led none.,racism,1,@pNibbler @AlterNet @MaxBlumenthal,,
5522-5266-2381-4330-24,5522-5266-2381-4330-24,Of course it is .  The Quran approves of both slavery and the rape of female slaves.,racism,1,@MoAnsar @arennie44,#Islam,http://t.co/axovjYZ8z0
5749-5010-5456-8689-92,5749-5010-5456-8689-92,do uk enough to understand the history of Islamic slavery?,racism,1,@greenlinerzjm @versacezaynx @nyazpolitics,,https://t.co/xWJzpSodGj
5633-6777-1208-0410-24,5633-6777-1208-0410-24,"Again, a Muslim liar trying to change the subject to hide the proven fact that her prophet is a pedophile.",racism,1,@semzyxx @owais00,,
5555-3517-2985-0369-92,5555-3517-2985-0369-92,"And if someone wants to leave Islam, then Islam declares him an apostate and demands that he be murdered.",racism,1,@_enzk @NNdabbour64,,
5648-8654-5119-7319-68,5648-8654-5119-7319-68,Japan was the original aggressor.  How does that excuse the continuing barbarity of Islam,racism,1,@Qoloob4 @Vandaliser @sajid_fairooz @IsraeliRegime,,
5739-5178-8568-5720-32,5739-5178-8568-5720-32,"They are not as stupid as you, since Islam is not a race.",racism,1,@congressman_aly @Pastle_souls,,
5525-3288-3630-7230-08,5525-3288-3630-7230-08,"Again, look at this chart and tell me were you get the ""a few"" idea.",racism,1,@HillaryGuess @riwired @izrinhariri,,http://t.co/QSTtdz57VJ
5767-6840-2091-4460-16,5767-6840-2091-4460-16,But who can blame him with his 24/7 schedule of promoting anti Semitism.,racism,1,@MaxBlumenthal,,
5684-8055-8902-3379-84,5684-8055-8902-3379-84,RT : Islamic terrorists are only practicing what's taught in Islam.That's the truth and the 'Elephant' in the room which ev…,racism,1,@TRobinsonNewEra,,
5753-7541-8552-7749-76,5753-7541-8552-7749-76,Blumenthal self promotion. The only groups that attack talks and kill people are Max's terrorist Muslim friends.,racism,1,@MaxBlumenthal @Campagnebds,,
5525-5887-3458-9130-24,5525-5887-3458-9130-24,The Hadith about the Arabian Penninsula is why Muslims will not rest till they destroy Israel.,racism,1,@ibnHlophe @eeviewonders @CTFleaMarkets,,
5644-5537-4837-6659-84,5644-5537-4837-6659-84,I don't see how that is relevant to how non Muslims were treated as third class citizens.,racism,1,@Vandaliser @sajid_fairooz @IsraeliRegime,,
5650-2455-5098-3130-24,5650-2455-5098-3130-24,Humanity struggled for hundreds of years to rid itself of the blight of slavery.  Leave it to the filth of  to bring it right back.,racism,1,,#Islam,
5561-6997-9272-2369-92,5561-6997-9272-2369-92,That is because Islam is stuck in the seventh century.,racism,1,@_Saracen_ @BOU_JASSIM,,
5749-5084-1716-6209-92,5749-5084-1716-6209-92,Your prophet never said that. And countries like Pakistan have a 90% domestic violence rate.,racism,1,@halalflaws @biebervalue @greenlinerzjm,,
5749-3474-0458-8280-32,5749-3474-0458-8280-32,The Shia militia are terrorists that are only slightly better than ISIS. Look at the Shia militia in Yemen.,racism,1,@MoonNor27,,
5746-8166-9543-7020-16,5746-8166-9543-7020-16,Up your ass terrorist bitch.,racism,1,@End_Bigotry @chezkig1 @edulixavot34 @georgegalloway @AbbsWinston @Bruciebabe @MaxBlumenthal,,
5753-2688-1655-8650-24,5753-2688-1655-8650-24,"No, it doesn't suggest that. Islamolunatics and left wing lunatics suggest that.",racism,1,@AlterNet @MaxBlumenthal,,
5602-9091-8226-3459-84,5602-9091-8226-3459-84,The Jews of Europe should just come to the US. Then the Europeans can allow Islam to take them backwards.,racism,1,@historyscoper,,
5641-7136-0348-2830-08,5641-7136-0348-2830-08,And you lie again. The majority of Muslims were forced into it.,racism,1,@buttercupashby @MaDaSaHaTtEr_17,,http://t.co/uMKItLB5h9
5655-2606-8325-3840-00,5655-2606-8325-3840-00,Muslim abuse and murder of minority religions continues in all Muslim majority countries.,racism,1,,#Islam #Pakistan #Syria,http://t.co/1UoMvZWcCq
5655-6345-0756-4519-68,5655-6345-0756-4519-68,RT :  court to hear case to designate  a state sponsor of terror,racism,1,@clarionproject,#Egypt #Turkey,http://t.co/1aQ8uJfshw http://t.co/kZwzyMUgOu
5766-3441-4941-1270-40,5766-3441-4941-1270-40,"Here, butthead, this gives a good summary of the Muslim persecution of Christians in Palestine.",racism,1,@dankmtl,,http://t.co/gvLellbFdP
5635-7673-5526-9569-92,5635-7673-5526-9569-92,99% of all inventions come from the west. Islam has produced nothing in 1000 years. Mohammed was an illiterate who produced nada,racism,1,@obsurfer84,,
5541-3251-9604-3390-08,5541-3251-9604-3390-08,"If you search objectively, you will find that the pedophile prophet Mohammed declared war on all humanity 1400 years ago.",racism,1,@muslmdawah,,
5623-5331-5019-6449-92,5623-5331-5019-6449-92,Looks like the Daeshbags are now completely broken and fleeing the Kobane area.,racism,1,@Citywolf_IS3 @azzamalirhabi,,http://t.co/gZnfQd5nNi
5622-7409-0988-2250-24,5622-7409-0988-2250-24,"Like every Muslim country, they find money for weapons, but they don't have the money for schools.",racism,1,@PressTV,,
5653-9066-9750-2309-76,5653-9066-9750-2309-76,It will be the same evil tentacles that are already there in a different uniform.,racism,1,@KJBar @JulieBishopMP,,
5594-7268-8516-0549-76,5594-7268-8516-0549-76,You are right. The violent murdering Muslims are the only ones who understand the meaning of their religion.,racism,1,@LifeInKhilafah,,
5647-9762-6843-8000-00,5647-9762-6843-8000-00,We are suppose to believe that Muslims defended themselves all the way to Europe &amp; India.,racism,1,@Qoloob4 @Vandaliser @sajid_fairooz @IsraeliRegime,,
5552-1109-7700-3070-08,5552-1109-7700-3070-08,You can preach coexistence all you want.  To Islamist you are just a useful idiot.,racism,1,@IAmThe1Teacher,,
5572-5602-4202-0229-76,5572-5602-4202-0229-76,That should be true. But ISIS exists to follow the religion exactly.,racism,1,@PoliticalAnt @Lithobolos @ZaibatsuNews,,
5663-0984-3481-2810-24,5663-0984-3481-2810-24,Every religion and non religion on the planet is at war with Islam. Every border with a Muslim state is a bloody border,racism,1,@WithTrish @JRehling,,
5559-1491-5928-8999-68,5559-1491-5928-8999-68,You animals are slitting throats and we are suppose to care that you are offended by cartoons.,racism,1,@Hafisabidrees,,http://t.co/elEbZtioDk
5644-7429-9763-8099-84,5644-7429-9763-8099-84,Because Islam makes people stupid.,racism,1,@Vandaliser @sajid_fairooz @IsraeliRegime,,
5747-5921-5945-7530-24,5747-5921-5945-7530-24,The  Muslims have never stopped their quest to exterminate Jews.,racism,1,@ardiem1m @MaxBlumenthal @oldkhayyam,#Islam,http://t.co/BHkr3Xrxpg
5551-5235-7277-7249-92,5551-5235-7277-7249-92,"First off, the cretins at Salon are 100% unaware that there is nothing that ISIS does that Mohammed did not also do.",racism,1,@Salon @TheMuslimGuy,,
5696-8089-4438-4330-24,5696-8089-4438-4330-24,FSA sold weapons they got from US to the Islamofascists.,racism,1,@Mwforhr @FauxNews_ @bebird @LVview,,
5680-7902-0299-9360-00,5680-7902-0299-9360-00,RT : Syria: Raqqa doctors claim  fighters sexually brutalize women; many reportedly fearful of rape,racism,1,@ThinkAgain_DOS,#ISIS,http://t.co/pZu2UAw…
5670-1621-3448-8920-32,5670-1621-3448-8920-32,Muslim terrorist execute people daily. But when rare response happens to that provocation they fake being the victims,racism,1,@_sara22_ @Number10gov,,
5698-7812-9772-0810-24,5698-7812-9772-0810-24,"The rapist represent Islam because it's approved in the Quran and Hadiths, microbrain.",racism,1,@KellyTurner99 @brushyblues @buellerishere,,
5766-1618-1508-9149-44,5766-1618-1508-9149-44,Any idiot would know that the expelling of Palestinians would not change the ratio of Christians to Muslims.,racism,1,@dankmtl @PeaceNotHate_,,
5617-1245-1343-7530-24,5617-1245-1343-7530-24,"No, that is the excuse Mohammed used to rob and murder. He states his genocidal intention here.",racism,1,@SirajZarook,,http://t.co/wWopuMN3xY
5747-9486-5554-2599-68,5747-9486-5554-2599-68,Islam declared war on all humanity 1400 years ago and denying it is simply a lie.,racism,1,@greenlinerzjm,,
5551-5514-3746-8060-16,5551-5514-3746-8060-16,"Do the trolls at Salon know that Mohammed led 17 major military expedition, most of them offensive? No chance.",racism,1,@Salon @TheMuslimGuy,#Islam,
5525-5723-4681-4300-16,5525-5723-4681-4300-16,Just because I have no religion does't mean that I don't want to stop Islam from murdering.,racism,1,@ilhaam673,,http://t.co/9KTe08yrfk
5751-8248-1164-3989-76,5751-8248-1164-3989-76,"Hey, at least he doesn't murder people for apostacy and blasphemy like your tribe of scum.",racism,1,@alihadi68 @rudoren @nytimes,,
5657-4896-7019-8030-08,5657-4896-7019-8030-08,"Haven't seen that much idiotic and incoherent babbling, cliche and second hand propaganda in a long time.  Blocked.",racism,1,@Israelites234 @Aliyaist,,
5702-9549-1663-1509-76,5702-9549-1663-1509-76,A. Their bodies are far from finishing growth. B. Their minds are far from finishing growth.,racism,1,@DianH4 @ExposeFalsehood,,
5756-6607-6152-7870-08,5756-6607-6152-7870-08,The majority have radical and violent opinions when they are polled about them.,racism,1,@pNibbler @AlterNet @MaxBlumenthal,,http://t.co/LnGUHxNRyJ
5532-0871-1271-8380-16,5532-0871-1271-8380-16,RT : Twisted Logic in the world of Islam,racism,1,@salmonfarmer1,,http://t.co/6nALv2HPc3
5736-2816-7983-7799-68,5736-2816-7983-7799-68,In the meantime the terrorists who want to destroy Israel have murdered hundreds of thousands and scum like you excuse them.,racism,1,@MaxBlumenthal,,
5749-6362-7486-1550-08,5749-6362-7486-1550-08,Mohammed raped Aishia when she was 9.,racism,1,@haroonstyles @biebervalue @greenlinerzjm @halalflaws,,http://t.co/7moZbSqhpG
5527-0451-1098-5029-76,5527-0451-1098-5029-76,"RT : Under Love Jihad, Muslims lure young Hindu girls &amp; then force them to convert to Islam. Romeos then go 4 their next prey…",racism,1,@OmprakashSewa,,
5603-0854-6202-3950-08,5603-0854-6202-3950-08,The logic of a retarded madrassa rat.,racism,1,@98Halima @cdnKhadija @BilalIGhumman @johnnygjokaj @rfrankh53,,
5766-3908-5730-6400-00,5766-3908-5730-6400-00,"And the number of Christians in Israel is increasing, while in all Muslim countries it is shrinking.",racism,1,@dankmtl,,
5526-0757-8543-2430-08,5526-0757-8543-2430-08,"Really, Muslims understand this.  They just want to be able to use the name ""racism"" to shut us up.",racism,1,@RichardDawkins @AbuelitoSerge,,
5652-9477-4417-3589-76,5652-9477-4417-3589-76,"What do you care, scumbag? You murder and enslave unarmed Ezidi and Christian civilians.",racism,1,@jihadi_11 @Sheikh_Times3,,
5563-4827-0080-1760-00,5563-4827-0080-1760-00,"International press couldn't even tell where the shells came from.  To hell with murdering Islamists, including Hamas.",racism,1,@yuskan0723,,
5648-5339-4087-5020-16,5648-5339-4087-5020-16,Which is why he gave himself as many wives as he wanted to satisfy his prick.,racism,1,@Qoloob4 @Vandaliser @sajid_fairooz @IsraeliRegime,,
5670-2964-9788-5059-84,5670-2964-9788-5059-84,"Furthermore, your heroes the Taliban are responsible for the murder of 80% of Afghan civilians. So stick it asshole.",racism,1,@shehzilk @watan71969,,
5767-4260-9449-6849-92,5767-4260-9449-6849-92,"All the lies they tell and the mantras they repeat about apartheid, etc. are all scripted propaganda and not spontaneous.",racism,1,@AAlwuhaib1977,,
5754-2487-2530-0839-68,5754-2487-2530-0839-68,Of course Muslim religious bigots like you think that is okay.,racism,1,@PTISalarKhan @georgegalloway,,
5693-5371-6966-3879-68,5693-5371-6966-3879-68,RT : OBAMA and his love for golf is greater that love for CHRISTIANS or Jews !,racism,1,@davidjones720,,http://t.co/LludcU5jSP
5747-7341-7213-1740-16,5747-7341-7213-1740-16,The poor women do it because they marry a Muslim man and are pressured into it. Men do it in prison. It's a criminal's relig,racism,1,@WitnessToAllah,,
5648-8751-5341-9139-84,5648-8751-5341-9139-84,"Yes, there is even more rape in Muslim countries but it is not reported.",racism,1,@Qoloob4 @Vandaliser @sajid_fairooz @IsraeliRegime,,
5766-0537-1877-3020-16,5766-0537-1877-3020-16,Islam is a strong supporter of murdering non Muslims. ISIS is a strong supporter of murdering non Muslims.,racism,1,@MaxBlumenthal @mehdirhasan @tnr,,
5641-7268-9670-0209-92,5641-7268-9670-0209-92,"Mohammed attacked the third Jewish tribe in Medina, beheaded all of it's men, sold all the rest to slavery",racism,1,@buttercupashby @MaDaSaHaTtEr_17,,
5766-9688-3256-4999-68,5766-9688-3256-4999-68,terrorists that have taken the church over. She was born an American and so was never subject to ...,racism,1,@AAlwuhaib1977 @dankmtl @PeaceNotHate_,,
5523-0296-9283-4369-92,5523-0296-9283-4369-92,The problem is that the cathedral doesn't understand that he prophet Mohammed declared war on all humanity 1400 years ago.,racism,1,@Religiolizer,,
5572-9335-0630-7399-68,5572-9335-0630-7399-68,"Your mantra about ""a few"" is stupid.  This proves it.",racism,1,@Lithobolos @PoliticalAnt @ZaibatsuNews,,http://t.co/3KyD0zp8yK
5740-1153-6827-4899-84,5740-1153-6827-4899-84,"RT : 🔵DEMS, the party that kicked GOD to the curb, but DEFENDS ISLAM!",racism,1,@Redeemed1952,,http://t.co/CRQJE6vvfT
5739-6925-5940-5429-76,5739-6925-5940-5429-76,"Fighting along side anyone in the ME makes you someone else's enemy, regardless of the motivation. Their problem, not ours.",racism,1,@alimhaider,,
5624-2448-2527-0560-00,5624-2448-2527-0560-00,I hear all kinds of people say that Jews control the agenda and the media.,racism,1,@ameytahl @Sam_Schulman @mathof1,,
5609-3386-1769-8880-00,5609-3386-1769-8880-00,"Your prophet used catapults to attack cities, murdering women and children.  So what are you crying about?",racism,1,@JihadiA8 @Lisa_Marie74,,
5746-8361-1640-6929-92,5746-8361-1640-6929-92,"98% of Muslims are killed by other Muslims, microbrain.",racism,1,@BDSSupporter,,http://t.co/f3erq7u9s3
5763-5853-4238-9859-84,5763-5853-4238-9859-84,And the problem is that Iran is an extremist theocratic autocracy.,racism,1,@mutludc,,
5642-2323-7244-9809-92,5642-2323-7244-9809-92,"Looks like you are the ignorant asshole, in that there is no other religion that has close to that number.",racism,1,@OneLegSandpiper @DblBlackDs,,
5751-8085-9927-4739-84,5751-8085-9927-4739-84,The filth of the Palestinian head choppers and honor killers and genocidal maniacs is there for the world to see.,racism,1,@_d_n_verg_ @stevesalaita,,
5572-5674-6087-8830-08,5572-5674-6087-8830-08,But Sharia is very sexist and 2/3 of Muslims want it.,racism,1,@PoliticalAnt @Lithobolos @ZaibatsuNews,,
5766-9719-6164-2190-08,5766-9719-6164-2190-08,the abuse that Christians who are stuck living with violent Muslims endure.,racism,1,@AAlwuhaib1977 @dankmtl @PeaceNotHate_,,
5667-0820-0141-8810-24,5667-0820-0141-8810-24,Europe needs to expel their Muslim immigrants.,racism,1,@MsIntervention,,
5745-5001-6548-6759-68,5745-5001-6548-6759-68,Wrong. Islam didn't give women any rights and it imprisoned them in their houses. Remember Katjia was wealthy BEFORE Islam.,racism,1,@SamihNewsam,,
5656-8085-2370-4689-92,5656-8085-2370-4689-92,"Why do you think your prophet called blacks ""rasin heads""?",racism,1,@abu__ramadi @ozchrisrock @amirshishani90,,
5740-2605-6920-7969-92,5740-2605-6920-7969-92,The term Islamophobia is like the term Naziphobia - stupid.,racism,1,@HNK2TheRescue @AtheiStranger @Independent @IndyVoices,,
5670-3646-5675-1210-24,5670-3646-5675-1210-24,If you don't think that Muslims invaded Christianity and Europe first you are to historically ignorant,racism,1,@truaemusic @mattybboi83 @Number10gov,,
5649-1209-8883-2929-92,5649-1209-8883-2929-92,"RT :  Rotherham whistleblower 'proved right' .Leftie police,Labour council protected the Muslim  rapists.https:/…",racism,1,@george3612 @ProudPatriot101,,
5642-4196-4673-9249-92,5642-4196-4673-9249-92,RT : The 3 Stages of the Islamic demographic Jihad...  =&gt;,racism,1,@robfit,#tcot,http://t.co/UttUXJPIf3
5646-4059-1489-6629-76,5646-4059-1489-6629-76,Democracy only means that people get to elect their leaders. Islam means they are ruled by freak god,racism,1,@_Jihadi_ @ansaralummah2 @lIlIlllIlIllI,,
5550-3017-2693-3159-68,5550-3017-2693-3159-68,The prophet Mohammed also had people murdered for criticizing him.  So the Paris murders were very much a part of the real,racism,1,,#Islam,
5637-9810-9377-9249-92,5637-9810-9377-9249-92,The Daesh are getting too thin on manpower to hold all the fronts where they need to fight.  Bombing does have an effect.,racism,1,,,
5755-4740-1257-2880-00,5755-4740-1257-2880-00,There is a reason that there are over 100 Islamic terrorist groups and why no other religion has such a phenomena.,racism,1,@nine11inreverse,,
5648-7462-2928-0519-68,5648-7462-2928-0519-68,They don't misinterpret and most Muslims are extremists.,racism,1,@Qoloob4 @Vandaliser @sajid_fairooz @IsraeliRegime,,http://t.co/UjA1vWVQ3y
5555-5894-4450-4120-32,5555-5894-4450-4120-32,Islam is a good place for criminals to find a home.,racism,1,@meghan_hurley,,
5766-1824-0098-5049-60,5766-1824-0098-5049-60,"Of course Muslims are exterminating Christians in Egypt,Pakistan,Turkey, etc. Why would it be different in Palistine",racism,1,@dankmtl @PeaceNotHate_,,
5758-7258-7764-3630-08,5758-7258-7764-3630-08,"RT : Australian Preacher Incites to Jihad against the Jews: ""They Are the Most Evil Creatures of Allah""   https…",racism,1,@stardust193,#Australia #Islam,
5603-1115-0894-5349-76,5603-1115-0894-5349-76,There is nothing that ISIS does that the prophet Mohammed didn't also do.,racism,1,@johnnygjokaj @BilalIGhumman @98Halima @cdnKhadija @rfrankh53,,
5573-5986-7707-3959-68,5573-5986-7707-3959-68,But Islam hates free speech.,racism,1,@hansthecat,,
5580-6747-1627-0629-76,5580-6747-1627-0629-76,Most Muslims instinctively understand that Islam cannot survive in light of day and must be protected by blasphemy laws,racism,1,@WalidShoebat,#Islam,
5740-2300-0850-1779-84,5740-2300-0850-1779-84,"So which ones are the ""moderate"" Muslims?",racism,1,@AndyG244,#Islam,http://t.co/Q1ArIVGq6H
5649-0710-4297-6970-24,5649-0710-4297-6970-24,RT : Labour councillors in Rotherham left vulnerable girls in the hands of KNOWN paedos and doing nothing for fear of being racist!…,racism,1,@LiarMPs,,
5762-5921-3871-0380-16,5762-5921-3871-0380-16,"Good, someone in the ME has finally stood up to the Muslim terrorists and their population imperialism.",racism,1,@MaxBlumenthal @Marc_Leibowitz,,
5674-3354-6403-2830-08,5674-3354-6403-2830-08,It's basically an empty excuse that leftists and Muslims use for their anti US bigotry.,racism,1,@jukes303,,
5678-1616-6162-3500-16,5678-1616-6162-3500-16,"Whatever happens in , when it is over the country will be in the hands of one Islamofascist group or another.",racism,1,,#Yemen #Islam,
5706-4876-3372-4090-24,5706-4876-3372-4090-24,This is actually the only kind of job that mujahedeen are intellectually suited for.,racism,1,@Generalshaami44,,
5580-6575-9826-7429-76,5580-6575-9826-7429-76,This guy spouted one lie after another and there is no response in this video.  Just typical lying Muslim propaganda.,racism,1,@digvijaya_28,#Islam,
5762-5631-5502-1740-16,5762-5631-5502-1740-16,"No, the murdering Hamaz head choppers torture children in dungeons.",racism,1,@muslimanarchist @Tobin_Maker @MaxBlumenthal,,
5646-3965-6310-8899-84,5646-3965-6310-8899-84,"Yeah, they could use camels for transport, abuse and rape women, own slaves, grovel to a terrorist god, pay Jizya, what fun.",racism,1,@lIlIlllIlIllI,,
5623-3559-8355-0259-84,5623-3559-8355-0259-84,"compared to the sewer and violence and poverty of Muslim Pakistan, Americans live in opulence.",racism,1,@UmarMal,,
5591-0750-3112-6140-16,5591-0750-3112-6140-16,Mohammed hid behind a trench in Medina when the Meccan army showed up.  So I guess he was a coward for that also.,racism,1,@_Ibn_Latif @Colonel_Shami,,
5659-0648-3779-3669-76,5659-0648-3779-3669-76,The next step in warfare is the ground drone. A robot that will walk up to the Jihadi and blow out his brains.,racism,1,@DawlatnaMansura,,
